{
  "taskId": "UI-5-run-overview",
  "reviewer": "Ben McCusker (@SixStringBny)",
  "reviewedAt": "2026-10-30T19:20:24.040Z",
  "decision": "approved",
  "evidence": [
    {
      "path": "docs/reviews/ui-overhaul/solo-flow.md",
      "sha256": "5352cf66a236bb039122f171af77c2f99395fef846df5eb6dfb373ea83fcb5a9"
    }
  ],
  "route": "run-overview",
  "commit": "ebae15c",
  "viewports": [
    "375x667",
    "390x844",
    "768x1024",
    "1024x768",
    "1280x800"
  ],
  "mechanical": {
    "owner": "qa-automation-engineer",
    "ranAt": "2026-10-30T19:20:24.040Z",
    "checks": [
      {
        "id": "AB-C1",
        "status": "pass",
        "test": "tests/e2e/ui-bar.spec.ts › solo run-overview at 375x667: objects, seal, focus, text and targets",
        "message": ""
      },
      {
        "id": "AB-C2",
        "status": "pass",
        "test": "tests/e2e/ui-bar.spec.ts › solo run-overview at 375x667: objects, seal, focus, text and targets",
        "message": ""
      },
      {
        "id": "AB-C3",
        "status": "pass",
        "test": "tests/e2e/ui-bar.spec.ts › AB-C3 no form furniture on play routes (run-overview at 375x667)",
        "message": "All five viewports."
      },
      {
        "id": "AB-G4",
        "status": "pass",
        "test": "tests/e2e/ui-bar.spec.ts › AB-G4 no horizontal page scroll on run-overview at 375x667",
        "message": "All five viewports."
      },
      {
        "id": "AB-G5",
        "status": "pass",
        "test": "tests/e2e/ui-bar.spec.ts › AB-G5 every target is at least 44px on run-overview at 375x667",
        "message": "All five viewports."
      },
      {
        "id": "AB-A1",
        "status": "pass",
        "test": "tests/e2e/ui-bar.spec.ts › AB-A1 axe reports zero WCAG 2.1 A/AA violations on run-overview at 375x667",
        "message": "Recorded label-in-name exemption for the deck/reward cards."
      },
      {
        "id": "AB-A2",
        "status": "pass",
        "test": "tests/e2e/ui-bar.spec.ts › AB-A2 every stateful control is glyph plus word (run-overview at 375x667)",
        "message": "All five viewports."
      },
      {
        "id": "AB-P1",
        "status": "pass",
        "test": "tests/e2e/ui-bar.spec.ts › solo run-overview at 375x667: objects, seal, focus, text and targets",
        "message": "The Next/Back action sits in the fixed phone bar."
      },
      {
        "id": "AB-P4",
        "status": "pass",
        "test": "tests/e2e/ui-bar.spec.ts › solo run-overview at 375x667: objects, seal, focus, text and targets",
        "message": "Ladder names and statuses at the text floors, no ellipsis."
      },
      {
        "id": "AB-T1",
        "status": "pass",
        "test": "tests/e2e/ui-bar.spec.ts › solo run-overview at 375x667: objects, seal, focus, text and targets",
        "message": "Ladder and status/next column side by side at 1024 and 1280."
      },
      {
        "id": "AB-T2",
        "status": "pass",
        "test": "tests/e2e/ui-bar.spec.ts › solo run-overview at 375x667: objects, seal, focus, text and targets",
        "message": "720/320 and 660/300 columns inside the capped page."
      },
      {
        "id": "AB-G6",
        "status": "pass",
        "test": "tests/e2e/ui-bar.spec.ts › solo run-overview at 375x667: objects, seal, focus, text and targets",
        "message": ""
      },
      {
        "id": "AB-A3",
        "status": "pass",
        "test": "src/styles/tokens.test.ts › AB-A3 token pairs meet the contrast floors",
        "message": ""
      },
      {
        "id": "AB-V1",
        "status": "pass",
        "test": "src/styles/tokens.test.ts › AB-V1 components consume semantic tokens",
        "message": ""
      },
      {
        "id": "AB-V2",
        "status": "pass",
        "test": "tests/e2e/ui-bar.spec.ts › AB-V2 one slate table and one parchment material on every route",
        "message": ""
      },
      {
        "id": "AB-V4",
        "status": "pass",
        "test": "tests/e2e/ui-bar.spec.ts › AB-V4 self-hosted display face and system UI stack",
        "message": ""
      }
    ],
    "summary": {
      "passed": 16,
      "failed": 0
    }
  },
  "human": {
    "owner": "Ben McCusker (@SixStringBny)",
    "reviewedAt": "2026-10-30T19:20:24.040Z",
    "viewports": [
      "390x844",
      "768x1024",
      "1280x800"
    ],
    "checks": [
      {
        "id": "H-C1",
        "status": "pass",
        "note": "The ladder is a status map with the current stone ringed and the run numbers beside it."
      },
      {
        "id": "H-C2",
        "status": "pass",
        "note": "Warm slate, parchment objects, brass rules and the seal language; the placeholder art does not clash."
      },
      {
        "id": "H-P1",
        "status": "pass",
        "note": "The vertical ladder scrolls by rows and the action bar stays fixed within thumb reach. Real 375px device pass attested by the owner on 2026-10-30."
      },
      {
        "id": "H-T1",
        "status": "pass",
        "note": "Ladder and status column share the table width at 1024 and 1280; no dead column."
      }
    ],
    "decision": "approved"
  },
  "issues": []
}
