{
  "taskId": "UI-7-round-result",
  "reviewer": "Ben McCusker (@SixStringBny)",
  "reviewedAt": "2026-10-30T19:20:24.040Z",
  "decision": "approved",
  "evidence": [
    {
      "path": "docs/reviews/ui-overhaul/duel-flow.md",
      "sha256": "efd170958f51a4e9d21818386e7b68c597c5ac3faec43912c3179f65dfa23fe4"
    }
  ],
  "route": "round-result",
  "commit": "ebae15c",
  "viewports": [
    "375x667",
    "390x844",
    "768x1024",
    "1024x768",
    "1280x800"
  ],
  "mechanical": {
    "owner": "qa-automation-engineer",
    "ranAt": "2026-10-30T19:20:24.040Z",
    "checks": [
      {
        "id": "AB-C1",
        "status": "pass",
        "test": "tests/e2e/duel.spec.ts › completes a best-of-three with a privacy handoff before every turn",
        "message": ""
      },
      {
        "id": "AB-C2",
        "status": "pass",
        "test": "tests/e2e/duel.spec.ts › completes a best-of-three with a privacy handoff before every turn",
        "message": "Next Round is the single action seal."
      },
      {
        "id": "AB-G4",
        "status": "pass",
        "test": "tests/e2e/duel.spec.ts › holds the setup, privacy and board geometry at all five viewports",
        "message": ""
      },
      {
        "id": "AB-G5",
        "status": "pass",
        "test": "tests/e2e/duel.spec.ts › holds the setup, privacy and board geometry at all five viewports",
        "message": ""
      },
      {
        "id": "AB-G6",
        "status": "pass",
        "test": "tests/e2e/duel.spec.ts › completes a best-of-three with a privacy handoff before every turn",
        "message": ""
      },
      {
        "id": "AB-A3",
        "status": "pass",
        "test": "src/styles/tokens.test.ts › AB-A3 token pairs meet the contrast floors",
        "message": ""
      },
      {
        "id": "AB-V1",
        "status": "pass",
        "test": "src/styles/tokens.test.ts › AB-V1 components consume semantic tokens",
        "message": ""
      },
      {
        "id": "AB-V2",
        "status": "pass",
        "test": "tests/e2e/ui-bar.spec.ts › AB-V2 one slate table and one parchment material on every route",
        "message": ""
      },
      {
        "id": "AB-V4",
        "status": "pass",
        "test": "tests/e2e/ui-bar.spec.ts › AB-V4 self-hosted display face and system UI stack",
        "message": ""
      }
    ],
    "summary": {
      "passed": 9,
      "failed": 0
    }
  },
  "human": {
    "owner": "Ben McCusker (@SixStringBny)",
    "reviewedAt": "2026-10-30T19:20:24.040Z",
    "viewports": [
      "390x844",
      "768x1024",
      "1280x800"
    ],
    "checks": [
      {
        "id": "H-C1",
        "status": "pass",
        "note": "A round verdict: winner, score, series strip and the next opener; Next Round is the action."
      },
      {
        "id": "H-C2",
        "status": "pass",
        "note": "Warm slate, parchment plaque and cards, brass rules and the rust seal language; nothing reads as generic dark fantasy."
      },
      {
        "id": "H-P1",
        "status": "pass",
        "note": "At 375 the plaque is full width with a 48px Next Round; no hand, health or log survives. Real 375px device pass attested by the owner on 2026-10-30."
      },
      {
        "id": "H-T1",
        "status": "pass",
        "note": "At 1024/1280 the 720px plaque keeps the score and strip inline."
      }
    ],
    "decision": "approved"
  },
  "issues": []
}
