{
  "taskId": "UI-7-privacy",
  "reviewer": "Ben McCusker (@SixStringBny)",
  "reviewedAt": "2026-10-30T19:20:24.040Z",
  "decision": "approved",
  "evidence": [
    {
      "path": "docs/reviews/ui-overhaul/duel-flow.md",
      "sha256": "efd170958f51a4e9d21818386e7b68c597c5ac3faec43912c3179f65dfa23fe4"
    }
  ],
  "route": "privacy",
  "commit": "ebae15c",
  "viewports": [
    "375x667",
    "390x844",
    "768x1024",
    "1024x768",
    "1280x800"
  ],
  "mechanical": {
    "owner": "qa-automation-engineer",
    "ranAt": "2026-10-30T19:20:24.040Z",
    "checks": [
      {
        "id": "AB-C1",
        "status": "pass",
        "test": "tests/e2e/ui-bar.spec.ts › AB-C1/C2 setup, privacy and board named objects",
        "message": ""
      },
      {
        "id": "AB-C2",
        "status": "pass",
        "test": "tests/e2e/ui-bar.spec.ts › AB-C1/C2 setup, privacy and board named objects",
        "message": "Exactly one action, I am ready."
      },
      {
        "id": "AB-A5",
        "status": "pass",
        "test": "tests/e2e/duel.spec.ts › completes a best-of-three with a privacy handoff before every turn",
        "message": "Forbidden selectors, hand count, card backs, meters, field, log and card names are absent while privacy is mounted."
      },
      {
        "id": "AB-A1",
        "status": "pass",
        "test": "tests/e2e/ui-bar.spec.ts › AB-A1 axe reports zero WCAG 2.1 A/AA violations on privacy at 375x667",
        "message": "No exemption on this route."
      },
      {
        "id": "AB-G1",
        "status": "pass",
        "test": "tests/e2e/ui-bar.spec.ts › AB-G1/P2/G4/G5 the board and privacy never page-scroll",
        "message": ""
      },
      {
        "id": "AB-P2",
        "status": "pass",
        "test": "tests/e2e/ui-bar.spec.ts › AB-G1/P2/G4/G5 the board and privacy never page-scroll",
        "message": ""
      },
      {
        "id": "AB-G6",
        "status": "pass",
        "test": "tests/e2e/duel.spec.ts › completes a best-of-three with a privacy handoff before every turn",
        "message": "Focus lands on I am ready and traps; Escape is a no-op."
      },
      {
        "id": "AB-A3",
        "status": "pass",
        "test": "src/styles/tokens.test.ts › AB-A3 token pairs meet the contrast floors",
        "message": ""
      },
      {
        "id": "AB-V1",
        "status": "pass",
        "test": "src/styles/tokens.test.ts › AB-V1 components consume semantic tokens",
        "message": ""
      },
      {
        "id": "AB-V2",
        "status": "pass",
        "test": "tests/e2e/ui-bar.spec.ts › AB-V2 one slate table and one parchment material on every route",
        "message": ""
      },
      {
        "id": "AB-V4",
        "status": "pass",
        "test": "tests/e2e/ui-bar.spec.ts › AB-V4 self-hosted display face and system UI stack",
        "message": ""
      }
    ],
    "summary": {
      "passed": 11,
      "failed": 0
    }
  },
  "human": {
    "owner": "Ben McCusker (@SixStringBny)",
    "reviewedAt": "2026-10-30T19:20:24.040Z",
    "viewports": [
      "390x844",
      "768x1024",
      "1280x800"
    ],
    "checks": [
      {
        "id": "H-C1",
        "status": "pass",
        "note": "A single opaque handoff card naming only the incoming player and one ready action."
      },
      {
        "id": "H-C2",
        "status": "pass",
        "note": "Warm slate, parchment plaque and cards, brass rules and the rust seal language; nothing reads as generic dark fantasy."
      },
      {
        "id": "H-P1",
        "status": "pass",
        "note": "At 375 the plaque is viewport-minus-32 wide with a full-width 48px ready button; nothing from the board is visible. Real 375px device pass attested by the owner on 2026-10-30."
      },
      {
        "id": "H-T1",
        "status": "pass",
        "note": "At 1024/1280 the plaque is 480px on the opaque slate; the score line is public text, not pips."
      }
    ],
    "decision": "approved"
  },
  "issues": []
}
