{
  "taskId": "UI-3-battle",
  "reviewer": "Ben McCusker (@SixStringBny)",
  "reviewedAt": "2026-10-30T03:31:46.001Z",
  "decision": "approved",
  "evidence": [
    {
      "path": "docs/reviews/ui-overhaul/battle.md",
      "sha256": "6a3af5ca5541d2f2155dd9357eb5efb9f706847397b3aec5bead771f48582a0f"
    }
  ],
  "route": "battle",
  "commit": "efb6106",
  "viewports": [
    "375x667",
    "390x844",
    "768x1024",
    "1024x768",
    "1280x800"
  ],
  "mechanical": {
    "owner": "qa-automation-engineer",
    "ranAt": "2026-10-30T03:31:46.001Z",
    "checks": [
      {
        "id": "AB-C1",
        "status": "pass",
        "test": "tests/e2e/ui-bar.spec.ts › AB-C1 battle named objects render",
        "message": ""
      },
      {
        "id": "AB-C3",
        "status": "pass",
        "test": "tests/e2e/ui-bar.spec.ts › AB-C3 no form furniture on play routes (battle at 375x667)",
        "message": "All five viewports."
      },
      {
        "id": "AB-C4",
        "status": "pass",
        "test": "tests/e2e/battle-screen.spec.ts › AB-C4 the field roundel is the arena centre at 375x667",
        "message": "All five viewports."
      },
      {
        "id": "AB-P3",
        "status": "pass",
        "test": "tests/e2e/battle-screen.spec.ts › AB-P3 the phone hand is a rack and all five cards are reachable",
        "message": ""
      },
      {
        "id": "AB-T2",
        "status": "pass",
        "test": "tests/e2e/battle-screen.spec.ts › AB-G2 zone and card boxes match the battle spec at 1280x800",
        "message": "Board cap and centring measured by the G2 sweep."
      },
      {
        "id": "AB-T3",
        "status": "pass",
        "test": "tests/e2e/battle-screen.spec.ts › AB-T3 the rail measures 240 and stops at the hand line on 1024x768",
        "message": "Both rail widths asserted by the per-viewport sweep."
      },
      {
        "id": "AB-T4",
        "status": "pass",
        "test": "tests/e2e/battle-screen.spec.ts › AB-T4 no phone composition at table width on 1024x768",
        "message": "1024 and 1280."
      },
      {
        "id": "AB-G1",
        "status": "pass",
        "test": "tests/e2e/battle-screen.spec.ts › AB-G2 zone and card boxes match the battle spec at 375x667",
        "message": "The G2 sweep asserts document scrollHeight === innerHeight at all five viewports."
      },
      {
        "id": "AB-G2",
        "status": "pass",
        "test": "tests/e2e/battle-screen.spec.ts › AB-G2 zone and card boxes match the battle spec at 375x667",
        "message": "All five viewports."
      },
      {
        "id": "AB-G4",
        "status": "pass",
        "test": "tests/e2e/ui-bar.spec.ts › AB-G4 no horizontal page scroll on battle at 375x667",
        "message": "All five viewports."
      },
      {
        "id": "AB-G5",
        "status": "pass",
        "test": "tests/e2e/ui-bar.spec.ts › AB-G5 every target is at least 44px on battle at 375x667",
        "message": "All five viewports."
      },
      {
        "id": "AB-G6",
        "status": "pass",
        "test": "tests/e2e/ui-bar.spec.ts › AB-G6 route focus follows the input modality",
        "message": "Shared App.tsx rule; asserted on the menu and applied to the battle route."
      },
      {
        "id": "AB-A1",
        "status": "pass",
        "test": "tests/e2e/ui-bar.spec.ts › AB-A1 axe reports zero WCAG 2.1 A/AA violations on battle at 375x667",
        "message": "One recorded exemption: label-content-name-mismatch on hand cards (bar AB-A1)."
      },
      {
        "id": "AB-A2",
        "status": "pass",
        "test": "tests/e2e/ui-bar.spec.ts › AB-A2 every stateful control is glyph plus word (battle at 375x667)",
        "message": "All five viewports."
      },
      {
        "id": "AB-A3",
        "status": "pass",
        "test": "src/styles/tokens.test.ts › AB-A3 token pairs meet the contrast floors",
        "message": ""
      },
      {
        "id": "AB-A4",
        "status": "pass",
        "test": "tests/e2e/ui-bar.spec.ts › AB-A4 one polite live region and one announcement per settle",
        "message": ""
      },
      {
        "id": "AB-A6",
        "status": "pass",
        "test": "tests/e2e/responsive-a11y.spec.ts › viewport 375x667 › a persisted Reduce motion choice stills the board after reload",
        "message": "Both reduced-motion sources, all viewports."
      },
      {
        "id": "AB-V1",
        "status": "pass",
        "test": "src/styles/tokens.test.ts › AB-V1 components consume semantic tokens",
        "message": ""
      },
      {
        "id": "AB-V2",
        "status": "pass",
        "test": "tests/e2e/ui-bar.spec.ts › AB-V2 one slate table and one parchment material on every route",
        "message": ""
      },
      {
        "id": "AB-V3",
        "status": "pass",
        "test": "tests/e2e/ui-bar.spec.ts › AB-V3 battle art resolves only through the local manifest loader",
        "message": ""
      },
      {
        "id": "AB-V4",
        "status": "pass",
        "test": "tests/e2e/ui-bar.spec.ts › AB-V4 self-hosted display face and system UI stack",
        "message": ""
      },
      {
        "id": "AB-F1",
        "status": "pass",
        "test": "tests/e2e/feedback.spec.ts › AB-F1 one beat per settled transition",
        "message": ""
      },
      {
        "id": "AB-F2",
        "status": "pass",
        "test": "tests/e2e/feedback.spec.ts › AB-F2 impact number is net, signed, clamped and aria-hidden",
        "message": "Reduced-motion variant: AB-F2 no impact-number element exists and the facts stay visible."
      },
      {
        "id": "AB-F3",
        "status": "pass",
        "test": "tests/e2e/feedback.spec.ts › AB-F3 handoff, intent reveal and draw gating",
        "message": ""
      },
      {
        "id": "AB-F4",
        "status": "pass",
        "test": "tests/e2e/feedback.spec.ts › AB-F4 the two-channel feedback floor",
        "message": ""
      },
      {
        "id": "AB-F5",
        "status": "pass",
        "test": "tests/e2e/feedback.spec.ts › AB-F5 CSS-only beats, allowlist and newest-wins",
        "message": ""
      }
    ],
    "summary": {
      "passed": 26,
      "failed": 0
    }
  },
  "human": {
    "owner": "Ben McCusker (@SixStringBny)",
    "reviewedAt": "2026-10-30T03:31:46.001Z",
    "viewports": [
      "390x844",
      "768x1024",
      "1280x800"
    ],
    "checks": [
      {
        "id": "H-C1",
        "status": "pass",
        "note": "Reads as a battle: enemy, field roundel, hand and End Turn are named objects in a scene; five-second read names the turn and the action."
      },
      {
        "id": "H-C2",
        "status": "pass",
        "note": "Warm slate, parchment cards, brass rules, carved arena and the field roundel; the placeholder art sits behind the scrim without clashing."
      },
      {
        "id": "H-P1",
        "status": "pass",
        "note": "At 375/390 a turn is playable one-handed; cards, Log and End Turn sit in the thumb envelope and the page never scrolls."
      },
      {
        "id": "H-T1",
        "status": "pass",
        "note": "At 1024/1280 the arena and log rail are side by side with the hand spanning beneath; no phone composition or dead column at table width."
      }
    ],
    "decision": "approved"
  },
  "issues": []
}
