{
  "taskId": "UI-6-run-result",
  "reviewer": "Ben McCusker (@SixStringBny)",
  "reviewedAt": "2026-10-30T05:14:25.061Z",
  "decision": "approved",
  "evidence": [
    {
      "path": "docs/reviews/ui-overhaul/reading-screens.md",
      "sha256": "c2e6dd8952b313f3732c377ce3805c38312158e384e76f25c336d225ec8bdc16"
    }
  ],
  "route": "run-result",
  "commit": "a0d6c76",
  "viewports": [
    "375x667",
    "390x844",
    "768x1024",
    "1024x768",
    "1280x800"
  ],
  "mechanical": {
    "owner": "qa-automation-engineer",
    "ranAt": "2026-10-30T05:14:25.061Z",
    "checks": [
      {
        "id": "AB-C1",
        "status": "pass",
        "test": "tests/e2e/reading-screens.spec.ts › the verdict sits on the slate above parchment ledgers at five widths",
        "message": ""
      },
      {
        "id": "AB-P4",
        "status": "pass",
        "test": "tests/e2e/reading-screens.spec.ts › the verdict sits on the slate above parchment ledgers at five widths",
        "message": "Totals 2x2 phone / 4-across table at the numeral size."
      },
      {
        "id": "AB-T2",
        "status": "pass",
        "test": "tests/e2e/reading-screens.spec.ts › the verdict sits on the slate above parchment ledgers at five widths",
        "message": "min(100%, 45rem) centred."
      },
      {
        "id": "AB-G4",
        "status": "pass",
        "test": "tests/e2e/reading-screens.spec.ts › the verdict sits on the slate above parchment ledgers at five widths",
        "message": "No horizontal scroll at five widths."
      },
      {
        "id": "AB-G5",
        "status": "pass",
        "test": "tests/e2e/reading-screens.spec.ts › the verdict sits on the slate above parchment ledgers at five widths",
        "message": "New Run and Menu at 44px."
      },
      {
        "id": "AB-G6",
        "status": "pass",
        "test": "tests/e2e/reading-screens.spec.ts › the route heading takes focus on arrival",
        "message": "Shared route-h1 focus."
      },
      {
        "id": "AB-A4",
        "status": "pass",
        "test": "tests/e2e/reading-screens.spec.ts › the verdict sits on the slate above parchment ledgers at five widths",
        "message": "The run result adds no live line."
      },
      {
        "id": "AB-A3",
        "status": "pass",
        "test": "src/styles/tokens.test.ts › AB-A3 token pairs meet the contrast floors",
        "message": ""
      },
      {
        "id": "AB-V1",
        "status": "pass",
        "test": "src/styles/tokens.test.ts › AB-V1 components consume semantic tokens",
        "message": ""
      },
      {
        "id": "AB-V2",
        "status": "pass",
        "test": "tests/e2e/ui-bar.spec.ts › AB-V2 one slate table and one parchment material on every route",
        "message": ""
      },
      {
        "id": "AB-V4",
        "status": "pass",
        "test": "tests/e2e/ui-bar.spec.ts › AB-V4 self-hosted display face and system UI stack",
        "message": ""
      }
    ],
    "summary": {
      "passed": 11,
      "failed": 0
    }
  },
  "human": {
    "owner": "Ben McCusker (@SixStringBny)",
    "reviewedAt": "2026-10-30T05:14:25.061Z",
    "viewports": [
      "390x844",
      "768x1024",
      "1280x800"
    ],
    "checks": [
      {
        "id": "H-C1",
        "status": "pass",
        "note": "A verdict, not a form: wax seal, outcome and two record ledgers; New Run is the action."
      },
      {
        "id": "H-C2",
        "status": "pass",
        "note": "Warm slate around a parchment sheet or verdict; brass rules, wax seals and Fraunces headings; no generic dark-fantasy chrome."
      },
      {
        "id": "H-P1",
        "status": "pass",
        "note": "At 375 the totals are 2x2 and New Run/Menu stack full width; nothing is clipped."
      },
      {
        "id": "H-T1",
        "status": "pass",
        "note": "At 1024/1280 the plaque is 720px with the totals four across and the best ledger inside it."
      }
    ],
    "decision": "approved"
  },
  "issues": []
}
