{
  "taskId": "UI-7-duel-setup",
  "reviewer": "Ben McCusker (@SixStringBny)",
  "reviewedAt": "2026-10-30T19:20:24.040Z",
  "decision": "approved",
  "evidence": [
    {
      "path": "docs/reviews/ui-overhaul/duel-flow.md",
      "sha256": "efd170958f51a4e9d21818386e7b68c597c5ac3faec43912c3179f65dfa23fe4"
    }
  ],
  "route": "duel-setup",
  "commit": "ebae15c",
  "viewports": [
    "375x667",
    "390x844",
    "768x1024",
    "1024x768",
    "1280x800"
  ],
  "mechanical": {
    "owner": "qa-automation-engineer",
    "ranAt": "2026-10-30T19:20:24.040Z",
    "checks": [
      {
        "id": "AB-C1",
        "status": "pass",
        "test": "tests/e2e/ui-bar.spec.ts › AB-C1/C2 setup, privacy and board named objects",
        "message": ""
      },
      {
        "id": "AB-C2",
        "status": "pass",
        "test": "tests/e2e/ui-bar.spec.ts › AB-C1/C2 setup, privacy and board named objects",
        "message": "Confirm/Start is the single action seal at each step."
      },
      {
        "id": "AB-G4",
        "status": "pass",
        "test": "tests/e2e/duel.spec.ts › holds the setup, privacy and board geometry at all five viewports",
        "message": "No horizontal scroll at the five viewports."
      },
      {
        "id": "AB-G5",
        "status": "pass",
        "test": "tests/e2e/duel.spec.ts › holds the setup, privacy and board geometry at all five viewports",
        "message": "Every target at least 44px."
      },
      {
        "id": "AB-G6",
        "status": "pass",
        "test": "tests/e2e/duel.spec.ts › holds the setup, privacy and board geometry at all five viewports",
        "message": "Step changes focus the new h2; the route h1 takes focus on arrival."
      },
      {
        "id": "AB-A1",
        "status": "pass",
        "test": "tests/e2e/ui-bar.spec.ts › AB-A1 axe reports zero WCAG 2.1 A/AA violations on the duel setup at 375x667",
        "message": "Recorded label-in-name exemption for the shared deck card."
      },
      {
        "id": "AB-A2",
        "status": "pass",
        "test": "tests/e2e/ui-bar.spec.ts › AB-A2 every stateful control is glyph plus word (duel-setup at 375x667)",
        "message": ""
      },
      {
        "id": "AB-A3",
        "status": "pass",
        "test": "src/styles/tokens.test.ts › AB-A3 token pairs meet the contrast floors",
        "message": ""
      },
      {
        "id": "AB-V1",
        "status": "pass",
        "test": "src/styles/tokens.test.ts › AB-V1 components consume semantic tokens",
        "message": ""
      },
      {
        "id": "AB-V2",
        "status": "pass",
        "test": "tests/e2e/ui-bar.spec.ts › AB-V2 one slate table and one parchment material on every route",
        "message": ""
      },
      {
        "id": "AB-V4",
        "status": "pass",
        "test": "tests/e2e/ui-bar.spec.ts › AB-V4 self-hosted display face and system UI stack",
        "message": ""
      }
    ],
    "summary": {
      "passed": 11,
      "failed": 0
    }
  },
  "human": {
    "owner": "Ben McCusker (@SixStringBny)",
    "reviewedAt": "2026-10-30T19:20:24.040Z",
    "viewports": [
      "390x844",
      "768x1024",
      "1280x800"
    ],
    "checks": [
      {
        "id": "H-C1",
        "status": "pass",
        "note": "Two sealed choices with the look-away banner and a locked summary; Start Match is the physical action."
      },
      {
        "id": "H-C2",
        "status": "pass",
        "note": "Warm slate, parchment plaque and cards, brass rules and the rust seal language; nothing reads as generic dark fantasy."
      },
      {
        "id": "H-P1",
        "status": "pass",
        "note": "At 375 the deck cards are one column, the step-2 marker is clear and the confirm bar stays in the thumb envelope. Real 375px device pass attested by the owner on 2026-10-30."
      },
      {
        "id": "H-T1",
        "status": "pass",
        "note": "At 1024/1280 the 2x2 deck table and the sticky bar use the width; the sealed marker never names the first pick."
      }
    ],
    "decision": "approved"
  },
  "issues": []
}
